{
  "$schema": "../../../lib/templates/manifest.schema.json",
  "schemaVersion": 1,
  "id": "money-dev",
  "slug": "money-dev",
  "name": "Money (dev)",
  "description": "Personal finance dashboard with own database, using the local dev image.",
  "icon": "money",
  "status": "available",
  "sortOrder": 11,
  "source": {
    "repository": "money-template-dev",
    "remote": "git@github.com:llm-to-apps/money-template.git",
    "path": "templates/money"
  },
  "git": {
    "mount": {
      "target": "/workspace",
      "strategy": "clone",
      "defaultBranch": "main",
      "preserve": ["node_modules", ".next"]
    }
  },
  "image": "os7-money:dev",
  "runtime": {
    "workdir": "/workspace",
    "appPort": 80,
    "agentPort": 7070,
    "restoreCommand": "npm install",
    "startupCommands": "npm run prisma:generate && npm run db:deploy && npm run db:seed",
    "appCommand": "npm run dev"
  },
  "resources": {
    "memory": {
      "reservationMb": 128,
      "limitMb": 1024
    },
    "cpu": {
      "reservation": 0.05,
      "limit": 1
    }
  },
  "services": {
    "mysql": {
      "required": true,
      "database": "project"
    },
    "oauth": {
      "required": true
    }
  },
  "env": {
    "template": {
      "NODE_ENV": "development",
      "NEXT_TELEMETRY_DISABLED": "1",
      "PROJECT_ID": "{{app.projectId}}",
      "APP_PUBLIC_URL": "{{app.publicUrl}}",
      "MYSQL_HOST": "mysql",
      "MYSQL_PORT": "3306",
      "MYSQL_DATABASE": "{{services.mysql.database}}",
      "MYSQL_USER": "{{services.mysql.user}}",
      "MYSQL_PASSWORD": "{{services.mysql.password}}",
      "DATABASE_URL": "mysql://{{services.mysql.user}}:{{services.mysql.password}}@mysql:3306/{{services.mysql.database}}",
      "OAUTH_CLIENT_ID": "{{services.oauth.clientId}}",
      "OAUTH_CLIENT_SECRET": "{{services.oauth.clientSecret}}",
      "AUTH_SECRET": "{{services.oauth.clientSecret}}",
      "REDIRECT_URI": "{{services.oauth.redirectUri}}",
      "OAUTH_REDIRECT_URI": "{{services.oauth.redirectUri}}",
      "OAUTH_ISSUER_URL": "{{services.oauth.issuerUrl}}",
      "OAUTH_AUTHORIZE_URL": "{{services.oauth.authorizeUrl}}",
      "OAUTH_TOKEN_URL": "{{services.oauth.tokenUrl}}",
      "OAUTH_USERINFO_URL": "{{services.oauth.userinfoUrl}}",
      "OAUTH_INTERNAL_TOKEN_URL": "{{services.oauth.internalTokenUrl}}",
      "OAUTH_INTERNAL_USERINFO_URL": "{{services.oauth.internalUserinfoUrl}}",
      "OS7_PROJECT_TOKEN_INTROSPECTION_URL": "{{services.oauth.internalProjectUserTokenIntrospectionUrl}}",
      "PROJECT_SERVICE_API_TOKEN": "{{services.oauth.projectServiceApiToken}}",
      "PROJECT_SERVICE_API_BASE_URI": "{{services.oauth.projectServiceApiBaseUri}}",
      "OAUTH_REQUEST_HOST": "{{services.oauth.requestHost}}"
    }
  }
}
